{
  "v": 1,
  "generated_from": "yai_primitives_v2_osgrade.csv (normalized) + runtime_plane_extension.v1",
  "rules": {
    "cli_alias_format": "<group>-<name>",
    "cli_canonical_id_format": "yai.<group>.<name>",
    "notes": [
      "Primitives define stable capability surfaces and their deterministic CLI bindings.",
      "CLI bindings point to registry commands; hardcoded commands must converge into registry over time."
    ]
  },
  "primitives": [
    {
      "id": "CLI-001",
      "layer": 0,
      "family": "CLI",
      "domain": "Lifecycle",
      "name": "Lifecycle",
      "definition": "Stack lifecycle operations exposed to operators.",
      "ops": [
        "up",
        "restart",
        "down"
      ],
      "depends_on": [
        "R-001",
        "R-002",
        "R-003",
        "R-004",
        "R-005"
      ],
      "determinism": "bounded (depends on runtime)",
      "failure_modes": [
        "E_LIFECYCLE_START_FAIL",
        "E_LIFECYCLE_STOP_FAIL"
      ],
      "cli": {
        "canonical_id": "yai.lifecycle.up",
        "group": "lifecycle",
        "name": "up",
        "alias": "lifecycle-up",
        "related": [
          "yai.lifecycle.restart",
          "yai.lifecycle.down"
        ]
      }
    },
    {
      "id": "CLI-002",
      "layer": 0,
      "family": "CLI",
      "domain": "Inspect",
      "name": "Inspect",
      "definition": "Read-only diagnostics and streams.",
      "ops": [
        "status",
        "logs",
        "monitor",
        "events"
      ],
      "depends_on": [
        "S-016",
        "S-026"
      ],
      "determinism": "bounded (depends on runtime)",
      "failure_modes": [
        "E_INSPECT_UNAVAILABLE"
      ],
      "cli": {
        "canonical_id": "yai.inspect.status",
        "group": "inspect",
        "name": "status",
        "alias": "inspect-status",
        "related": [
          "yai.inspect.logs",
          "yai.inspect.monitor",
          "yai.inspect.events"
        ]
      }
    },
    {
      "id": "CLI-003",
      "layer": 0,
      "family": "CLI",
      "domain": "Verify",
      "name": "Verify",
      "definition": "Verification and test gates.",
      "ops": [
        "verify",
        "test"
      ],
      "depends_on": [
        "T-015",
        "S-008"
      ],
      "determinism": "deterministic",
      "failure_modes": [
        "E_VERIFY_FAIL"
      ],
      "cli": {
        "canonical_id": "yai.verify.verify",
        "group": "verify",
        "name": "verify",
        "alias": "verify-verify",
        "related": [
          "yai.verify.test"
        ]
      }
    },
    {
      "id": "CLI-004",
      "layer": 0,
      "family": "CLI",
      "domain": "Control",
      "name": "Control Plane",
      "definition": "Control plane entrypoints for root/kernel/engine/mind/boot operations.",
      "ops": [
        "root",
        "kernel",
        "engine",
        "mind",
        "boot"
      ],
      "depends_on": [
        "R-001",
        "R-002",
        "R-003",
        "R-004",
        "R-005"
      ],
      "determinism": "bounded (depends on runtime)",
      "failure_modes": [
        "E_CONTROL_UNAVAILABLE"
      ],
      "cli": {
        "canonical_id": "yai.control.root",
        "group": "control",
        "name": "root",
        "alias": "control-root",
        "related": [
          "yai.control.kernel",
          "yai.control.engine",
          "yai.control.mind",
          "yai.control.boot"
        ]
      }
    },
    {
      "id": "O-001",
      "layer": 2,
      "family": "Orchestration",
      "domain": "Distribution",
      "name": "Pack",
      "definition": "Installable/versioned domain pack unit (policy+trials+contracts).",
      "ops": [
        "install",
        "pin",
        "list",
        "resolve"
      ],
      "depends_on": [
        "S-006",
        "S-018",
        "T-004",
        "T-006"
      ],
      "determinism": "deterministic",
      "failure_modes": [
        "E_PACK_NOT_FOUND",
        "E_PACK_CONFLICT"
      ],
      "cli": {
        "canonical_id": "yai.orch.pack",
        "group": "orch",
        "name": "pack",
        "alias": "orch-pack"
      }
    },
    {
      "id": "O-002",
      "layer": 2,
      "family": "Orchestration",
      "domain": "Test unit",
      "name": "Trial",
      "definition": "Executable qualification unit: input \u2192 Run + records + metrics.",
      "ops": [
        "run",
        "describe",
        "list",
        "replay"
      ],
      "depends_on": [
        "T-012",
        "S-029",
        "S-034"
      ],
      "determinism": "deterministic",
      "failure_modes": [
        "E_TRIAL_FAIL",
        "E_TRIAL_UNSUPPORTED"
      ],
      "cli": {
        "canonical_id": "yai.orch.trial",
        "group": "orch",
        "name": "trial",
        "alias": "orch-trial"
      }
    },
    {
      "id": "O-003",
      "layer": 2,
      "family": "Orchestration",
      "domain": "Plan",
      "name": "Plan",
      "definition": "Declarative wave plan executable deterministically.",
      "ops": [
        "render",
        "lock",
        "execute",
        "diff"
      ],
      "depends_on": [
        "S-015",
        "S-034"
      ],
      "determinism": "deterministic",
      "failure_modes": [
        "E_PLAN_INVALID"
      ],
      "cli": {
        "canonical_id": "yai.orch.plan",
        "group": "orch",
        "name": "plan",
        "alias": "orch-plan"
      }
    },
    {
      "id": "O-004",
      "layer": 2,
      "family": "Orchestration",
      "domain": "Engine",
      "name": "Runner",
      "definition": "Executes Trial/Plan, emits canonical records, applies validate fail-fast.",
      "ops": [
        "execute",
        "emit",
        "checkpoint",
        "abort"
      ],
      "depends_on": [
        "S-042",
        "S-008"
      ],
      "determinism": "deterministic",
      "failure_modes": [
        "E_RUNNER_INTERNAL"
      ],
      "cli": {
        "canonical_id": "yai.orch.runner",
        "group": "orch",
        "name": "runner",
        "alias": "orch-runner"
      }
    },
    {
      "id": "O-005",
      "layer": 2,
      "family": "Orchestration",
      "domain": "Output",
      "name": "Emitter",
      "definition": "Materializes records/artifacts and links refs/hashes deterministically.",
      "ops": [
        "emit-event",
        "emit-decision",
        "emit-effect",
        "emit-metrics",
        "flush"
      ],
      "depends_on": [
        "S-010",
        "S-004",
        "S-005",
        "S-013"
      ],
      "determinism": "deterministic",
      "failure_modes": [
        "E_EMIT_IO",
        "E_EMIT_SCHEMA"
      ],
      "cli": {
        "canonical_id": "yai.orch.emit",
        "group": "orch",
        "name": "emit",
        "alias": "orch-emit"
      }
    },
    {
      "id": "O-006",
      "layer": 2,
      "family": "Orchestration",
      "domain": "Bundles",
      "name": "Bundle Assemble",
      "definition": "Assemble bundle payloads and manifests for governed delivery.",
      "ops": [
        "compose",
        "validate",
        "emit"
      ],
      "depends_on": [
        "S-005",
        "S-011",
        "T-012"
      ],
      "determinism": "deterministic",
      "failure_modes": [
        "E_BUNDLE_COMPOSE",
        "E_BUNDLE_VALIDATE"
      ],
      "cli": {
        "canonical_id": "yai.bundle.bundle",
        "group": "bundle",
        "name": "bundle",
        "alias": "bundle-bundle"
      }
    },
    {
      "id": "O-007",
      "layer": 2,
      "family": "Orchestration",
      "domain": "Verification",
      "name": "Verification Run",
      "definition": "Execute deterministic verification workflow and emit evidence pointers.",
      "ops": [
        "run",
        "report",
        "seal"
      ],
      "depends_on": [
        "T-012",
        "S-014",
        "S-017"
      ],
      "determinism": "deterministic",
      "failure_modes": [
        "E_VERIFY_FAIL",
        "E_VERIFY_INCOMPLETE"
      ],
      "cli": {
        "canonical_id": "yai.verify.verify",
        "group": "verify",
        "name": "verify",
        "alias": "verify-verify"
      }
    },
    {
      "id": "O-009",
      "layer": 2,
      "family": "Orchestration",
      "domain": "Automation",
      "name": "Job",
      "definition": "Scheduled execution with stable status and logs.",
      "ops": [
        "schedule",
        "run",
        "status",
        "cancel"
      ],
      "depends_on": [
        "S-026",
        "S-016"
      ],
      "determinism": "deterministic",
      "failure_modes": [
        "E_JOB_FAIL"
      ],
      "cli": {
        "canonical_id": "yai.orch.job",
        "group": "orch",
        "name": "job",
        "alias": "orch-job"
      }
    },
    {
      "id": "O-010",
      "layer": 2,
      "family": "Orchestration",
      "domain": "Reporting",
      "name": "Report",
      "definition": "Human+machine output derived from verified artifacts (index, findings).",
      "ops": [
        "build",
        "render",
        "export"
      ],
      "depends_on": [
        "S-013"
      ],
      "determinism": "deterministic",
      "failure_modes": [
        "E_REPORT_FAIL"
      ],
      "cli": {
        "canonical_id": "yai.orch.report",
        "group": "orch",
        "name": "report",
        "alias": "orch-report"
      }
    },
    {
      "id": "R-001",
      "layer": 1,
      "family": "Runtime",
      "domain": "Plane",
      "name": "Boot Plane",
      "definition": "Boot bring-up and boot-time verification surface.",
      "ops": [
        "start",
        "status",
        "logs",
        "verify",
        "stop"
      ],
      "depends_on": [
        "S-016",
        "S-026",
        "S-017"
      ],
      "determinism": "bounded (depends on environment)",
      "failure_modes": [
        "E_BOOT_NOT_FOUND",
        "E_BOOT_START_FAIL",
        "E_BOOT_VERIFY_FAIL"
      ],
      "cli": {
        "canonical_id": "yai.control.boot",